customer_id,customer_name,customer_industry,customer_state_cd,customer_state_name,customer_country_cd,customer_country_name,ingestion_ts
CUST-001, Acme Corp, Logistics, NY,, US,,2026-03-09 22:04:59.402656
CUST-003, SteelWorks Inc, Manufacturing, PA,, US,,2026-03-09 22:04:59.402656
CUST-007, BuildRight Construction, Construction, NY,, US,,2026-03-09 22:04:59.402656
CUST-006, HealthPlus Medical, Healthcare, FL,, US,,2026-03-09 22:04:59.402656
CUST-004, TechStart Innovations, Technology, CA,, US,,2026-03-09 22:04:59.402656
CUST-002, Bright Retail, Retail, TX,, US,,2026-03-09 22:04:59.402656
CUST-005, GreenEnergy Solutions, Energy, TX,, US,,2026-03-09 22:04:59.402656
CUST-008, FoodChain Logistics, Logistics, IL,, US,,2026-03-09 22:04:59.402656
